Tytuł,Cena,URL,ASIN,Opis,Ocena,Liczba opinii,Dostępność,Sprzedawca,Cechy,Szczegóły techniczne
"Czterordzeniowy Laptop, Różowe Złoto 16G RAM 512G ROM 15.6 Cal Laptop z Ekranem IPS z klawiaturą numeryczną dla 10 do Pracy (16+512G Wtyczka UE)",2569,https://www.amazon.pl/Czterordzeniowy-Ekranem-klawiatur%C4%85-numeryczn%C4%85-Wtyczka/dp/B0CG9WBDZY,B0CG9WBDZY,"1. DLA PROCESORA CELERON N5095: laptop o przekątnej 15,6 cala jest zasilany przez procesor Celeron N5095 o częstotliwości taktowania do 2,9 GHz, 4 rdzenie i 4 wątki zapewniające działanie bez opóźnień, dzięki czemu urządzenie działa płynnie podczas codziennej pracy i zabawy, dzięki czemu jest pierwszym wybór dla biura biznesowego lub studentów.
2. 15,6-CALOWY WYŚWIETLACZ IPS: Dzięki 15,6-calowemu wyświetlaczowi IPS o rozdzielczości 1920x1080 tekst i obrazy są ostre i wyraźne. Współczynnik proporcji 3:2 rozszerza pionową przestrzeń ekranu, aby wyświetlić więcej treści, zapewniając komfortowe wrażenia wizualne i większą wydajność podczas przeglądania sieci lub dokumentów.
3. Z PODŚWIETLANĄ KLAWIATURĄ: Czterordzeniowy laptop jest wyposażony w pełnowymiarową podświetlaną klawiaturę i duży panel dotykowy z klawiaturą numeryczną, który ułatwia pisanie i zapewnia widoczność nawet w ciemności. Zawiera wysokiej jakości zawias, który ułatwia udostępnianie i współpracę.
4. 16 GB RAM 512 GB ROM: Laptop z systemem 10 jest wyposażony w 16 GB pamięci RAM (LPDDR4) i szybki dysk SSD ROM 512 GB, co pozwala na płynne korzystanie z niego bez zacinania się, nawet gdy otwartych jest wiele programów. Zapewnia ogromną ilość miejsca na wydajne działanie najbardziej złożonego oprogramowania.
5. WIELE INTERFEJSÓW: Laptop odblokowywany odciskiem palca jest zasilany nową kompozytową baterią litowo-jonową, która zapewnia do 8 godzin pracy na baterii, co w zupełności wystarcza do codziennego użytku. Szeroka gama interfejsów do codziennego użytku. Wyjątkowo smukły korpus o stylowym wyglądzie i łatwy do przenoszenia.

Specyfikacja:
Typ produktu: Laptop 15,6 cala
Materiał obudowy: ABS, LCD
System operacyjny: 10
Język Wsparcie: domyślny język angielski, obsługa wielu języków
Centralna jednostka przetwarzająca (CPU): dla N5095 2,0 GHz (do 2,9 GHz) czterordzeniowy,","","Liczba gwiazdek: 5
0%",Dostępne sztuki: 2 – zamów teraz.,Herexty,"DLA PROCESORA CELERON N5095: laptop o przekątnej 15,6 cala jest zasilany przez procesor Celeron N5095 o częstotliwości do 2,9 GHz, 4 rdzenie i 4 wątki zapewniające działanie bez opóźnień, dzięki czemu urządzenie działa płynnie w codziennej pracy i zabawie, co czyni go pierwszym wyborem dla biuro firmy lub studenci.|15,6-CALOWY WYŚWIETLACZ IPS: Dzięki 15,6-calowemu wyświetlaczowi IPS o rozdzielczości 1920x1080 tekst i obrazy są ostre i wyraźne. Współczynnik proporcji 3:2 rozszerza pionową przestrzeń ekranu, aby wyświetlić więcej treści, zapewniając komfortowe wrażenia wizualne i większą wydajność podczas przeglądania sieci lub dokumentów.|Z PODŚWIETLANĄ KLAWIATURĄ: Czterordzeniowy laptop jest wyposażony w pełnowymiarową podświetlaną klawiaturę i duży panel dotykowy z klawiaturą numeryczną, który ułatwia pisanie i zapewnia widoczność nawet w ciemności. Zawiera wysokiej jakości zawias, który ułatwia udostępnianie i współpracę.|16 GB RAM 512 GB ROM: laptop z systemem 10 jest wyposażony w 16 GB pamięci RAM (LPDDR4) i szybki dysk SSD ROM 512 GB, co pozwala na płynne korzystanie z niego bez zacinania się, nawet gdy otwartych jest wiele programów. Zapewnia ogromną ilość miejsca na wydajne działanie najbardziej złożonego oprogramowania.|WIELE INTERFEJSÓW: Laptop odblokowywany odciskiem palca jest zasilany nową kompozytową baterią litowo-jonową, która zapewnia do 8 godzin pracy na baterii, co w zupełności wystarcza do codziennego użytku. Szeroka gama interfejsów do codziennego użytku. Ultra smukły korpus o stylowym wyglądzie i łatwy do przenoszenia.","{""Marka"":""Haofy"",""Producent"":""Haofy"",""Model"":""Haofyb2ph4k9mwg-12"",""Nazwa modelu"":""Haofyb2ph4k9mwg-12"",""Numer części"":""Haofyb2ph4k9mwg-12"",""Pojemność pamięci masowej"":""512 GB"",""Liczba procesorów"":""4"",""Rozmiar wyświetlacza stojącego"":""15,6 Cale"",""Wymagane baterie"":""Nie"",""Wejście interfejsu urządzeń HID (do wprowadzania danych przez człowieka)"":""Panel dotykowy, Klawiatura"",""Numer modelu"":""Haofyb2ph4k9mwg-12"",""Wymiary opakowania"":""43 x 29 x 10 cm; 2,12 kg"",""ASIN"":""B0CG9WBDZY"",""Gwarantowane aktualizacje oprogramowania do"":""nieznany(-na)""}"
"Lenovo Thinkpad E16 Gen 1 - Laptop 16"" WUXGA (Intel Core i5-1335U, 8 GB RAM, 256SSD, Zintegrowana zintegrowana karta graficzna Intel Iris Xe, W11Pro), Graphite Black -Hiszpański QWERTY klawiatura",2631,https://www.amazon.pl/Lenovo-Thinkpad-E16-Gen-Zintegrowana/dp/B0CM68CYZ3,B0CM68CYZ3,"16"" WQXGA | Intel Core i5-1335U | 8 GB | 256 GB SSD | Intel UHD Graphics | Win 11 Pro | 1Yr Depot","",Liczba ocen: 1,Dostępny,,"16-calowy ekran WUXGA (1920x1200) IPS 300nits Anti-glare, 45% NTSC|Procesor Intel i5-1335U, 10C (2P + 8E) / 12T, P-core 1.3 / 4.6GHz, E-core 0.9 / 3.4GHz, 12MB|Pamięć RAM 8 GB lutowane DDR4-3200|Pamięć masowa SSD 256 GB M.2 2242 PCIe 4.0x4 NVMe Opal 2.0|Zintegrowana karta graficzna Intel Iris Xe Graphics jako karta graficzna UHD Graphics|W11 Pro","{""Marka"":""Lenovo"",""Producent"":""Lenovo"",""Seria"":""TP E16 G1"",""Wymiary opakowania"":""48,9 x 33,3 x 8 cm; 1,7 kg"",""Numer modelu"":""196804682877"",""Kolor"":""Biały,"",""Kształt"":""Netbook"",""Rozdzielczość wyświetlania"":""1920 x 1200 pixels"",""Rozdzielczość"":""1920x1200"",""Marka procesora"":""Intel"",""Liczba procesorów"":""1"",""Rodzaj pamieci komputera"":""DDR4 SDRAM"",""Pojemność dysku twardego"":""256 GB"",""Opis dysku twardego"":""SSD"",""Opis karty graficznej"":""Zintegrowana"",""System operacyjny"":""Windows 11 Pro"",""ASIN"":""B0CM68CYZ3"",""Gwarantowane aktualizacje oprogramowania do"":""nieznany(-na)""}"
"HP Laptop 15-fc0630nd | 15,6"" Full HD Antiglare IPS | AMD Ryzen 5 7520U | 16GB RAM | 512GB SSD | Windows 11 | Klawiatura QWERTY",2302,https://www.amazon.pl/HP-15-fc0630nd-Antiglare-Windows-Klawiatura/dp/B0D47JZBQZ,B0D47JZBQZ,"HP Laptop 15-fc0630nd to wydajny, cienki laptop zaprojektowany z myślą o codziennej wydajności i trwałości. Ten niedrogi laptop o przekątnej 15,6"" jest wyposażony w wiele funkcji, które pomogą Ci efektywnie wykonywać swoją pracę, a przyjazny dla środowiska design przyczynia się do bardziej zrównoważonej przyszłości.","",Liczba ocen: 3,Dostępny,,"AMD RYZEN 5-PROCESSOR - Ciesz się doskonałą wydajnością notebooka. Nowa rewolucyjna architektura o wyjątkowo długiej żywotności baterii z wielowątkowym procesorem i kartą graficzną Vega do intensywnych zadań multimedialnych.|TRWAŁA KONSTRUKCJA – ponieważ wszystkie elementy pomagają, w konstrukcji tego produktu wykorzystano zrównoważone materiały, takie jak plastik z recyklingu i plastik z recyklingu z produktów konsumenckich.|Wyświetlacz Full HD - Ciesz się krystalicznie czystym obrazem i obrazem dzięki doskonałej jakości wynoszącej 2 miliony pikseli. Rozdzielczość 1920 x 1080 nadaje wszystkim cyfrowym treściom nowy wymiar.|HP Fast Charge - Gdy bateria laptopa jest niska, nie chcesz czekać godzinami na ponowne naładowanie. Wyłącz urządzenie i naładuj od 0% do 50% w ciągu około 45 minut.|HP True Vision FHD - Nawiązywanie połączeń wideo o najwyższej jakości obrazu w rozdzielczości Full HD nawet w słabo oświetlonych środowiskach, dzięki czemu każda rozmowa stanie się osobista, aby pozostać w kontakcie.|Certyfikat NERGY STAR - Oszczędzaj pieniądze i energię dzięki certyfikatowi ENERGY STAR certyfikowanej przez EPA, która pozwala zmniejszyć zużycie energii i zaoszczędzić pieniądze tam, gdzie to się liczy.","{""Marka"":""HP"",""Producent"":""HP"",""Wymiary produktu"":""35 x 23,6 x 1,86 cm; 2,26 kg"",""Baterie:"":""1 Litowo-polimerowa"",""Numer modelu"":""A6TM9EA#ABH 15-fc0630nd"",""Kolor"":""Silver"",""Kształt"":""Ultra-przenośny"",""Rozmiar wyświetlacza stojącego"":""15,6 Cale"",""Rozdzielczość wyświetlania"":""1920 x 1080 pixels"",""Rozdzielczość"":""1920x1080"",""Marka procesora"":""AMD"",""Typ procesora"":""AMD Ryzen 7"",""Szybkość procesora"":""2,8 GHz"",""Liczba procesorów"":""4"",""Rodzaj pamieci komputera"":""DDR5 RAM"",""Maksymalna ilość obsługiwanej pamięci"":""16 GB"",""Prędkość zegara pamięci"":""5500 MHz"",""Pojemność dysku twardego"":""512 GB"",""Opis dysku twardego"":""512 GB NVMe M.2 SSD"",""Interfejs dysku twardego"":""USB-C"",""Szczegóły audio"":""Słuchawki"",""Koprocesor graficzny"":""amd radeon"",""GPU"":""AMD"",""Opis karty graficznej"":""Zintegrowana"",""Typ pamięci RAM karty graficznej"":""VRAM"",""Interfejs karty graficznej"":""Zintegrowane"",""Technologia komunikacji bezprzewodowej"":""Wi-fi"",""Typ bezprzewodowy"":""802.11.ax"",""Liczba portów USB 2.0"":""1"",""Liczba portów USB 3.0"":""2"",""Liczba portów HDMI"":""1"",""Napięcie"":""19.5"",""Rozdzielczość przedniej kamery internetowej"":""1080 MP"",""System operacyjny"":""Windows 11"",""Średni czas czuwania akumulatora"":""4 Godziny"",""Średni czas pracy baterii"":""10 Godziny"",""Pojemność akumulatora litowego"":""41 Watogodziny"",""Liczba baterii litowo-jonowych"":""3"",""ASIN"":""B0D47JZBQZ"",""Gwarantowane aktualizacje oprogramowania do"":""nieznany(-na)""}"
"Lenovo Notebook V15 G4 IRU 15,6"" i5-13420H 3,4 GHz RAM 16 GB SSD 512 GB NVMe-Win 11 Prof Black (83A100A6IX) Marka",2881,https://www.amazon.pl/Lenovo-Notebook-i5-13420H-NVMe-Win-83A100A6IX/dp/B0CT62F6PF,B0CT62F6PF,"Informacje o tym produkcie
Notebook model NOTEBOOK LENOVO V15 G4 IRU 15,6"" i5-13420H 3,4 GHz RAM 16 GB SSD 512 GB NVMe-WIN 11 PROF BLACK (83A100A6IX)","",Liczba ocen: 20,Liczba dostępnych szt.: 4. Zapasy zostaną niedługo uzupełnione.,,"Notebook model NOTEBOOK LENOVO V15 G4 IRU 15,6"" i5-13420H 3,4 GHz RAM 16 GB SSD 512 GB NVMe-WIN 11 PROF BLACK (83A100A6IX)","{""Marka"":""Lenovo"",""Producent"":""Lenovo"",""Seria"":""V15 G4 IRU"",""Wymiary opakowania"":""53,29 x 33,5 x 7,2 cm; 1,65 kg"",""Baterie:"":""1 Litowo-polimerowa (w zestawie)"",""Numer modelu"":""420489"",""Kolor"":""Biały,"",""Kształt"":""Notebook"",""Rozmiar wyświetlacza stojącego"":""15,6 Cale"",""Rozdzielczość wyświetlania"":""1920 x 1080 pixels"",""Rozdzielczość"":""1920x1080 Piksele"",""Marka procesora"":""Intel"",""Typ procesora"":""Core i5"",""Szybkość procesora"":""3,4 GHz"",""Liczba procesorów"":""8"",""RAM"":""16 GB"",""Rodzaj pamieci komputera"":""DDR4 SDRAM"",""Maksymalna ilość obsługiwanej pamięci"":""16 GB"",""Pojemność dysku twardego"":""512 GB"",""Opis dysku twardego"":""SSD"",""Interfejs dysku twardego"":""Stan sały"",""Szczegóły audio"":""Głośniki, Słuchawki"",""Koprocesor graficzny"":""Intel"",""GPU"":""Intel"",""Opis karty graficznej"":""Zintegrowana"",""Typ pamięci RAM karty graficznej"":""Współdzielona"",""Interfejs karty graficznej"":""Zintegrowane"",""Technologia komunikacji bezprzewodowej"":""Bluetooth"",""Typ bezprzewodowy"":""802.11a/b/g/n/ac"",""Liczba portów USB 2.0"":""1"",""Liczba portów USB 3.0"":""2"",""Liczba portów HDMI"":""1"",""Liczba portów Ethernet"":""1"",""Typ napędu optycznego"":""Brak napędu optycznego"",""Platforma sprzętowa"":""Windows 11 Pro"",""System operacyjny"":""Windows 11 Pro"",""Czy baterie są dołączone"":""Tak"",""Pojemność akumulatora litowego"":""38 Watogodziny"",""Liczba baterii litowo-jonowych"":""3"",""Język"":""Włoski, Włoski"",""ASIN"":""B0CT62F6PF"",""Gwarantowane aktualizacje oprogramowania do"":""nieznany(-na)""}"
"MSI Nowoczesny laptop 15 Lifestyle & Business 15,6"", wyświetlacz Full HD, procesor AMD Ryzen 5 7530U, 16 GB DDR4 RAM, 512 GB SSD, AMD Radeon Graphics, Windows 11 Home, czarny, B7M-284",2329,https://www.amazon.pl/MSI-Nowoczesny-Lifestyle-Business-wy%C5%9Bwietlacz/dp/B0CRLHHPM3,B0CRLHHPM3,"Informacje o tym produkcie
Układ klawiatury to QWERTZ
Nowoczesny laptop 15 oferuje idealne połączenie modnego wyglądu, mobilności i wysokiej wydajności, aby utrzymać produktywność również w podróży. Dzięki dużemu ekranowi szerokopasmowemu o przekątnej 15,6"" i bardzo smukłemu formatowi przenośny sprinter jest idealny dla użytkowników i kobiet, którzy chcą mieć swój laptop zawsze przy sobie w pracy i w czasie wolnym
Niewielka wysokość 19,9 mm i waga 1,75 kg, nowoczesny procesor 15 z mobilnym procesorem AMD Ryzen 7000 zapewnia szybką moc obliczeniową do kreatywnej pracy
Karta graficzna AMD Radeon przyspiesza aplikacje multimedialne i osobistą produktywność. Karta PCI-Express SSD zapewnia błyskawiczne uruchamianie systemu i programowania
Nowoczesne wyposażenie interfejsu zapewnia najlepszą łączność – w tym wyjście monitora HDMI, port USB-C, czytnik kart microSD, Wi-Fi 6E oraz możliwość korzystania z zasilaczy USB PD i powerbanków do zasilania w podróży
Szczegółowy arkusz danych technicznych znajduje się w dolnej części strony: Przewodniki produktu i dokumenty. (Przewiń w dół)","",Liczba ocen: 268,Dostępne sztuki: 9 – zamów teraz.,Little.Brick,"Układ klawiatury to QWERTZ|Nowoczesny laptop 15 oferuje idealne połączenie modnego wyglądu, mobilności i wysokiej wydajności, aby utrzymać produktywność również w podróży. Dzięki dużemu ekranowi szerokopasmowemu o przekątnej 15,6"" i bardzo smukłemu formatowi przenośny sprinter jest idealny dla użytkowników i kobiet, którzy chcą mieć swój laptop zawsze przy sobie w pracy i w czasie wolnym|Niewielka wysokość 19,9 mm i waga 1,75 kg, nowoczesny procesor 15 z mobilnym procesorem AMD Ryzen 7000 zapewnia szybką moc obliczeniową do kreatywnej pracy|Karta graficzna AMD Radeon przyspiesza aplikacje multimedialne i osobistą produktywność. Karta PCI-Express SSD zapewnia błyskawiczne uruchamianie systemu i programowania|Nowoczesne wyposażenie interfejsu zapewnia najlepszą łączność – w tym wyjście monitora HDMI, port USB-C, czytnik kart microSD, Wi-Fi 6E oraz możliwość korzystania z zasilaczy USB PD i powerbanków do zasilania w podróży|Szczegółowy arkusz danych technicznych znajduje się w dolnej części strony: Przewodniki produktu i dokumenty. (Przewiń w dół)","{""Marka"":""MSI"",""Producent"":""MSI"",""Seria"":""Modern 15 B7M-284"",""Wymiary opakowania"":""46,6 x 30,3 x 7,7 cm; 1,75 kg"",""Baterie:"":""1 Litowo-polimerowa (w zestawie)"",""Numer modelu"":""0015HK-284"",""Kolor"":""czarny"",""Kształt"":""Laptop"",""Rozmiar wyświetlacza stojącego"":""15,6 Cale"",""Rozdzielczość wyświetlania"":""1920 x 1080 pixels"",""Rozdzielczość"":""1920x1080"",""Marka procesora"":""AMD"",""Typ procesora"":""Ryzen 5"",""Szybkość procesora"":""4,5 GHz"",""Liczba procesorów"":""1"",""Rodzaj pamieci komputera"":""DDR4 SDRAM"",""Maksymalna ilość obsługiwanej pamięci"":""16 GB"",""Pojemność dysku twardego"":""512 GB"",""Opis dysku twardego"":""SSD"",""Interfejs dysku twardego"":""Serial ATA"",""Szczegóły audio"":""internal, HDMI"",""Koprocesor graficzny"":""AMD Radeon"",""GPU"":""AMD"",""Opis karty graficznej"":""Karta graficzna AMD Radeon™"",""Typ pamięci RAM karty graficznej"":""DDR4 SDRAM"",""Interfejs karty graficznej"":""Zintegrowane"",""Technologia komunikacji bezprzewodowej"":""Wi-fi"",""Typ bezprzewodowy"":""802.11.ax"",""Liczba portów USB 3.0"":""2"",""Liczba portów HDMI"":""1"",""Typ napędu optycznego"":""Brak"",""System operacyjny"":""Windows 11 Home"",""Czy baterie są dołączone"":""Tak"",""Pojemność akumulatora litowego"":""39,3 Watogodziny"",""Liczba baterii litowo-jonowych"":""3"",""ASIN"":""B0CRLHHPM3"",""Gwarantowane aktualizacje oprogramowania do"":""nieznany(-na)""}"
"TULPAR A5 V20.4.3 laptop gamingowy, wyświetlacz LED 15,6"" FHD 1920 x 1080 144 Hz, procesor Intel Core i5 12450H, 16 GB RAM, 500 GB SSD, Nvidia RTX 4050, FreeDOS Gaming Notebook",3257,https://www.amazon.pl/TULPAR-gamingowy-wy%C5%9Bwietlacz-procesor-Notebook/dp/B0DH8B419P,B0DH8B419P,"Informacje o tym produkcie
Ciesz się najwyższą wydajnością i szybkością dzięki procesorowi Intel Core i5 12450H, który z łatwością spełni Twoje potrzeby w grach i wielozadaniowości. W połączeniu z 16 GB pamięci RAM, ten laptop oferuje imponującą wydajność, która umożliwia płynną pracę każdej gry i każdej aplikacji.
Ciesz się imponującą wydajnością gier dzięki laptopowi TULPAR wyposażonemu w kartę graficzną Nvidia RTX 4050. Zanurz się w płynnym, szczegółowym świecie gry i ciesz się niezrównanymi wrażeniami z gry. RTX 4050 wyznacza nowe standardy w zakresie wydajności i realizmu, dzięki czemu możesz w pełni cieszyć się grami. Odkryj najlepsze wrażenia z gier z TULPAR i Nvidia RTX 4050.
Dzięki ogromnemu dyskowi SSD o pojemności 500 GB masz więcej niż wystarczająco dużo miejsca, aby zapisać wszystkie gry, dokumenty i multimedia. Technologia SSD zapewnia również błyskawiczne ładowanie i płynną wydajność, dzięki czemu można spędzać mniej czasu na czekaniu, a więcej na grach. Laptop gamingowy TULPAR jest gotowy, aby poprowadzić Cię w kolejną erę gier.
Ciesz się swoimi grami jak nigdy dotąd na imponującym ekranie Full HD 144 Hz laptopa TULPAR Dzięki wysokiej częstotliwości odświeżania i wyraźnej rozdzielczości Twoje gry będą żywe i zapewniają niewiarygodnie płynne wrażenia podczas gry. Zanurz się w świecie gier dzięki laptopowi TULPAR","","Liczba gwiazdek: 5
0%",Dostępny,TULPAR GAMING NOTEBOOK,"Ciesz się najwyższą wydajnością i szybkością dzięki procesorowi Intel Core i5 12450H, który z łatwością spełni Twoje potrzeby w grach i wielozadaniowości. W połączeniu z 16 GB pamięci RAM, ten laptop oferuje imponującą wydajność, która umożliwia płynną pracę każdej gry i każdej aplikacji.|Ciesz się imponującą wydajnością gier dzięki laptopowi TULPAR wyposażonemu w kartę graficzną Nvidia RTX 4050. Zanurz się w płynnym, szczegółowym świecie gry i ciesz się niezrównanymi wrażeniami z gry. RTX 4050 wyznacza nowe standardy w zakresie wydajności i realizmu, dzięki czemu możesz w pełni cieszyć się grami. Odkryj najlepsze wrażenia z gier z TULPAR i Nvidia RTX 4050.|Dzięki ogromnemu dyskowi SSD o pojemności 500 GB masz więcej niż wystarczająco dużo miejsca, aby zapisać wszystkie gry, dokumenty i multimedia. Technologia SSD zapewnia również błyskawiczne ładowanie i płynną wydajność, dzięki czemu można spędzać mniej czasu na czekaniu, a więcej na grach. Laptop gamingowy TULPAR jest gotowy, aby poprowadzić Cię w kolejną erę gier.|Ciesz się swoimi grami jak nigdy dotąd na imponującym ekranie Full HD 144 Hz laptopa TULPAR Dzięki wysokiej częstotliwości odświeżania i wyraźnej rozdzielczości Twoje gry będą żywe i zapewniają niewiarygodnie płynne wrażenia podczas gry. Zanurz się w świecie gier dzięki laptopowi TULPAR","{""Marka"":""TULPAR"",""Producent"":""TULPAR"",""Seria"":""A5 V20.4"",""Wymiary produktu"":""36,02 x 24,35 x 2,3 cm; 4,5 kg"",""Kształt"":""składany notebook"",""Rozmiar wyświetlacza stojącego"":""15,6 Cale"",""Rozdzielczość wyświetlania"":""1920 x 1080 pixels"",""Rozdzielczość"":""1920x1080"",""Marka procesora"":""Intel"",""Typ procesora"":""Core i5-12450H"",""Szybkość procesora"":""3,3 GHz"",""Liczba procesorów"":""8"",""Rodzaj pamieci komputera"":""DDR4 SDRAM"",""Maksymalna ilość obsługiwanej pamięci"":""64 GB"",""Pojemność dysku twardego"":""5E+2 GB"",""Opis dysku twardego"":""SSD"",""GPU"":""NVIDIA"",""Opis karty graficznej"":""Dedykowana"",""Typ pamięci RAM karty graficznej"":""GDDR6"",""Interfejs karty graficznej"":""PCI Express"",""Liczba portów USB 2.0"":""1"",""Typ napędu optycznego"":""Brak"",""System operacyjny"":""DOS"",""Czy baterie są dołączone"":""Nie"",""ASIN"":""B0DH8B419P"",""Gwarantowane aktualizacje oprogramowania do"":""nieznany(-na)""}"
"Lenovo ThinkPad E16 G2 21M5002VGE - 16"" WUXGA, Ryzen 5 7535HS, 32GB, 1TB, Windows 11 Pro",3899,https://www.amazon.pl/Lenovo-ThinkPad-E16-G2-21M5002VGE/dp/B0D58N37XQ,B0D58N37XQ,"Lenovo ThinkPad E16 G2 21M5002VGE - 16"" WUXGA, Ryzen 5 7535HS, 32GB, 1TB, Windows 11 Pro","",Liczba ocen: 1,Liczba dostępnych szt.: 3. Zapasy zostaną niedługo uzupełnione.,,21M5002VGE,"{""Marka"":""Lenovo"",""Model"":""EP-DX510JWEGEU"",""Wymiary opakowania"":""48,6 x 34,29 x 8 cm; 217 g"",""Producent"":""Lenovo"",""Numer modelu"":""21M5002VGE"",""ASIN"":""B0D58N37XQ""}"
"Laptop 15,6"" z podświetleniem tła, metalowa obudowa, laptop gamingowy z wyświetlaczem 1080P FHD, AMD Ryzen7 5700U (8C/16T, do 4,3 GHz), 16 GB DDR4,1TB PCIe SSD, klawiatura cyfrowa, odcisk palca,",2455,https://www.amazon.pl/Laptop-pod%C5%9Bwietleniem-gamingowy-wy%C5%9Bwietlaczem-klawiatura/dp/B0DBGYQBHM,B0DBGYQBHM,"Model: Y156N
Rozmiar: 15,6 cala
Rozdzielczość ekranu: 1920 x 1080 pikseli.
Producent procesora: AMD
Model procesora: Ryzen 7 5700u
Rdzeń: ośmiordzeniowy
Pamięć RAM: 16 GB.
ROM: 1TB
WiFi: 6.0
Bluetooth: 4.2.
Aparat: 1,0 MP.
Akumulator: 6 godzin.
System operacyjny: Windows 11 Pro
Materiał: metal
Podświetlana klawiatura: tak
Rozpoznawanie linii papilarnych: tak.
Możliwość rozszerzenia pamięci: tak.","",Liczba ocen: 1,Dostępny,Molegar Official store,"【Nie martw się po sprzedaży】Molegar oferuje roczną , możesz skonsultować się ze sprzedawcą lub poprosić o serwis gwarancyjny na wszystko, co zostało zakupione w sklepie Molegar Shop. Wskazówka: Naciśnij i przytrzymaj klawisz Fn, a następnie naciśnij F5, aby aktywować lub wyłączyć podświetlaną klawiaturę.|【Wysoka wydajność AMD Ryzen7】Laptop Melogar jest wyposażony w wysokiej wydajności procesor AMD Ryzen 7 5700u 7 nm z 8 rdzeniami i 16 wątkami oraz główną częstotliwością 1,8 GHz, przyspieszenie do 4,3 GHz, a nowa grafika RadeonGraphics umożliwia 30% zwiększenie wydajności grafiki, co nie tylko zmniejsza zużycie energii. i wydajność berberberale również z łatwością spełnia codzienne wymagania biurowe i rozrywkowe|【Kratka ochronna na oczy 1920 x 1080 FHD】Wciągające wrażenia wizualne o przekątnej ekranu 15,6"", zawsze uspokaja oczy. Prawdziwe odwzorowanie żywych kolorów, piękne zdjęcia przed oczami, mikro-luneta zapewnia większe pole widzenia do biura, nauki i rozrywki|【16 GB DDR4,1 TB SSD + 256 GB rozszerzenia】Ten laptop gamingowy jest sparowany z pamięcią RAM 16 GB DDR4 o wysokiej częstotliwości i 1 TB, która jest super szybka i responsywna oraz łatwo radzi sobie z wielozadaniowością, jest wyposażony w gniazdo kart TF, które można rozszerzyć do maksymalnie 256 GB, co zapewnia dużo miejsca na pamięć. Kilka plików jest|【Długi czas pracy baterii wynoszący 6 godzin】Oryginalna ładowarka do ładowarki DC, obsługa PD szybkie ładowanie, najszybsze ładowanie może być pełne w ciągu dwóch godzin, pojemność do 6000 mAh, żywotność może wynosić do 6 godzin, czy to na spotkania w biurze, w podróży służbowej i podczas rozrywki może zapewnić wystarczającą ilość energii|【Cienka i lekka konstrukcja + 180° otwieranie i zamykanie konstrukcji】 Ten ultralekki laptop biurowy, rozszerzony wyczucie pełności, brak obciążenia, może trzymać jedną ręką, ekran można obracać o 180°, wahadła biznesowe i mobilne biuro jest łatwe do wykonania, wytrzymały i trwały oraz o wysokiej wartości|【Ergonomiczna klawiatura z podświetleniem w pełnym rozmiarze】Więcej ergonomicznych, wielkoformatowych klawiszy, z podświetlaną klawiaturą w pełnym rozmiarze, wygodna obsługa, aby towarzyszyć Ci w każdej chwili, gdy używasz niezależnego obszaru klawiatury, możesz cieszyć się przenośną i szybką|【WiFi 6, Bluetooth 4.2, kamera HD】Wiodąca technologia WiFi 6 łączy się szybko i stabilnie, uzyskaj szybki dostęp do Internetu, 4 głośniki Hi-Fi i kamera HD podczas wideokonferencji oraz rozmowy głosowe mogą być wyraźne, gładkie i wydajne","{""Marka"":""Molegar"",""Producent"":""Molegar"",""Seria"":""Y156N"",""Wymiary produktu"":""88,9 x 76,2 x 5,08 cm; 2,79 kg"",""Baterie:"":""1 Litowo-polimerowa (w zestawie)"",""Numer modelu"":""2024 Neueste Ankunft Ultra Slim Laptop"",""Kolor"":""szary"",""Kształt"":""Ultra-przenośny"",""Rozmiar wyświetlacza stojącego"":""15,6 Cale"",""Rozdzielczość wyświetlania"":""1920 x 1080 pixels"",""Rozdzielczość"":""1920x1080"",""Marka procesora"":""AMD"",""Typ procesora"":""AMD Ryzen 7"",""Szybkość procesora"":""4,3 GHz"",""Liczba procesorów"":""8"",""Technologia pamięci"":""DDR4"",""Rodzaj pamieci komputera"":""DDR4 SDRAM"",""Maksymalna ilość obsługiwanej pamięci"":""16 GB"",""Prędkość zegara pamięci"":""4,3 GHz"",""Pojemność dysku twardego"":""1 TB"",""Opis dysku twardego"":""SSD"",""Interfejs dysku twardego"":""PCIE x 4"",""Szczegóły audio"":""Głośniki, Słuchawki"",""Koprocesor graficzny"":""AMD Radeon R7"",""GPU"":""AMD"",""Opis karty graficznej"":""Zintegrowana"",""Typ pamięci RAM karty graficznej"":""DDR4 SDRAM"",""Rozmiar pamięci RAM karty graficznej"":""16 GB"",""Interfejs karty graficznej"":""Zintegrowane"",""Technologia komunikacji bezprzewodowej"":""Bluetooth, Wi-fi"",""Typ bezprzewodowy"":""802.11a/b/g/n/ac"",""Liczba portów USB 3.0"":""2"",""Napięcie"":""19 Wolty"",""Typ napędu optycznego"":""Nie"",""Rozdzielczość przedniej kamery internetowej"":""1 MP"",""System operacyjny"":""Windows 11 Pro"",""Średni czas pracy baterii"":""6 Godziny"",""Czy baterie są dołączone"":""Tak"",""Pojemność akumulatora litowego"":""6000 Watogodziny"",""Liczba baterii litowo-jonowych"":""4"",""ASIN"":""B0DBGYQBHM"",""Gwarantowane aktualizacje oprogramowania do"":""nieznany(-na)""}"
