Tytuł,Cena,URL,ASIN,Opis,Ocena,Liczba opinii,Dostępność,Sprzedawca,Cechy,Szczegóły techniczne
"ASUS ROG Ally X RC72LA-NH007W Czarny - 7"" FHD, AMD Ryzen Z1 Extreme, 24GB LPDDR5X RAM, 1TB M.2 SSD (2280), Windows 11 Home",3704,https://www.amazon.pl/ASUS-ROG-Ally-RC72LA-NH007W-Czarny/dp/B0D6Z6MFN4,B0D6Z6MFN4,"Console ROG Ally X Noir / 24Go / 1To
Produit neuf d'origine Asus
Garantie 24 mois
Facture disponible sur demande

ASUS SKU : ROGALLY-X","",Liczba ocen: 30,Dostępny,Accessoires PC,"Procesor: Ekstremalny procesor AMD Ryzen Z1 (architektura ""Zen4"" z procesem 4nm, 8-rdzeniowy/16-wątkowy, całkowita pamięć podręczna 24MB, do 5,10 Ghz boost) Moc procesora: TDP: 9-30W IGPU: AMD Radeon Graphics (AMD RDNA 3, 12 CUs, do 2,7 GHz, do 8,6 Teraflops)|Rozmiar ekranu: 7 cali Definicja Ekran: FHD (1920 x 1080) 16:9 Częstotliwość odświeżania: 120Hz Czas reakcji (G2G): 7ms Rodzaj szkła: Gorilla Glass Victus Ekran dotykowy: Ekran dotykowy (10-punktowy Multi-Touch) Kąt widzenia: 85/85/85/85 Technologia płytek : IP. S-level Jasność: 500nitów Kontrast: 1200:1 Rodzaj obróbki płytek: Błyszczący ekran Technologia adaptacyjna-Sync: FreeSync Premium|Pamięć wbudowana: wbudowany 12 GB x 2 LPDDR5 Całkowita pamięć systemowa: LPDDR5X 24 GB Wielokanałowa technologia pamięci: Obsługa pamięci podwójnego kanału Zainstalowana pamięć systemowa: 1 TB PCIe 4.0 NVMe M.2 SSD (2280) Ilość obsługiwanych gniazd M.2 (SATA/NVME): 1 Lista obsługi M.2 .2 SSD: M.2 2280 1TB SSD / M.2 2280 512GB SSD|Łączność bezprzewodowa: Wi-Fi 6E (802.11ax) (potrójne pasmo) 2*2 + Bluetooth 5.2 (*Wersja Bluetooth może się różnić w zależności od systemu operacyjnego). Porty wejścia/wyjścia: 1x Thunderbolt 4 obsługa DisplayPort / power delivery - 1x USB 3.2 Gen 2 Type-C obsługa DisplayPort / power delivery - 1x czytnik kart microSD UHS-II (obsługuje SD, SDXC i SDHC) Wyjście wideo N /A: Audio 1x 3,5 mm Combo Audio Jack mikrofon: Wbudowany in array mikrofon Technologia Aura Sync : Tak|Technologia audio: Technologia łącząca hałas AI / Dolby Atmos / certyfikat Hi-Res (dla słuchawek) / Technologia inteligentnego wzmacniacza System operacyjny: Windows 11 Home Wymiary (dł. x szer. x wys.): 28,0 x 11,1 x 2,47 ~ 3,69 cm Waga: 670 g","{""Marka"":""ASUS"",""Producent"":""asus"",""Seria"":""ROG Ally X"",""Wymiary opakowania"":""35 x 15 x 10 cm; 1 g"",""Baterie:"":""4 C"",""Numer modelu"":""90NV00F1-M000E0"",""Kolor"":""czarny"",""Kształt"":""Ultra-przenośny"",""Rozmiar wyświetlacza stojącego"":""7 Cale"",""Rozdzielczość wyświetlania"":""1920 x 1080 pixels"",""Rozdzielczość"":""1920x1080"",""Marka procesora"":""AMD"",""Typ procesora"":""AMD A Series"",""Szybkość procesora"":""5,1 GHz"",""Liczba procesorów"":""8"",""Rodzaj pamieci komputera"":""DDR5 RAM"",""Maksymalna ilość obsługiwanej pamięci"":""24 GB"",""Pojemność dysku twardego"":""1 TB"",""Opis dysku twardego"":""1TB NVMe M.2 SSD"",""Interfejs dysku twardego"":""PCIE x 4"",""Szczegóły audio"":""Słuchawki"",""Koprocesor graficzny"":""AMD Radeon Graphics"",""GPU"":""AMD"",""Opis karty graficznej"":""Zintegrowana"",""Interfejs karty graficznej"":""Zintegrowane"",""Technologia komunikacji bezprzewodowej"":""Bluetooth"",""Typ bezprzewodowy"":""802.11.ax"",""Platforma sprzętowa"":""Komputer"",""System operacyjny"":""Windows 11 Home"",""Pojemność akumulatora litowego"":""80 Watogodziny"",""Liczba baterii litowo-jonowych"":""4"",""ASIN"":""B0D6Z6MFN4"",""Gwarantowane aktualizacje oprogramowania do"":""nieznany(-na)""}"
"HUAWEI MateBook D 16 (2024) - Core i5 12th, 16GB 512GB, Grau 16 Zoll Notebook mit FullView FHD Display",2857,https://www.amazon.pl/HUAWEI-MateBook-16-Notebook-FullView/dp/B0CMZLPZP1,B0CMZLPZP1,"HUAWEI MateBook D 16 (2024) - Core i5 12th, 16GB 512GB, Grau 16 Zoll Notebook mit FullView FHD Display","",Liczba ocen: 35,Liczba dostępnych szt.: 3. Zapasy zostaną niedługo uzupełnione.,,53013WYU,"{""Marka"":""HUAWEI"",""Producent"":""Huawei"",""Seria"":""MitchellF-W5651"",""Wymiary produktu"":""10 x 5 x 1,27 cm; 1,7 kg"",""Baterie:"":""1 Litowo-polimerowa (w zestawie)"",""Numer modelu"":""MitchellF-W5651"",""Kolor"":""Kolor: czarny"",""Rozmiar wyświetlacza stojącego"":""16 Cale"",""Rozdzielczość wyświetlania"":""1920 x 1200 pixels"",""Marka procesora"":""Intel"",""Typ procesora"":""5X86"",""Szybkość procesora"":""3.4"",""Gniazdo procesora"":""BGA 413"",""Liczba procesorów"":""8"",""RAM"":""16"",""Technologia pamięci"":""DDR3"",""Rodzaj pamieci komputera"":""DDR4 SDRAM"",""Maksymalna ilość obsługiwanej pamięci"":""16 GB"",""Prędkość zegara pamięci"":""3.2E+3 MHz"",""Pojemność dysku twardego"":""80"",""Opis dysku twardego"":""SSD"",""Interfejs dysku twardego"":""Serial ATA"",""Prędkość obrotowa dysku twardego"":""7200"",""Szczegóły audio"":""Bluetooth"",""Koprocesor graficzny"":""Intel Iris Xe Graphics"",""GPU"":""Intel"",""Opis karty graficznej"":""Zintegrowana"",""Typ pamięci RAM karty graficznej"":""72-Pin EDO SIMM Memory"",""Rozmiar pamięci RAM karty graficznej"":""8"",""Interfejs karty graficznej"":""AGP"",""Technologia komunikacji bezprzewodowej"":""Bluetooth"",""Typ bezprzewodowy"":""Bluetooth"",""Liczba portów USB 2.0"":""1"",""Liczba portów USB 3.0"":""1"",""Liczba portów HDMI"":""1"",""Typ napędu optycznego"":""BD-R"",""System operacyjny"":""Windows 11"",""Czy baterie są dołączone"":""Tak"",""Pojemność akumulatora litowego"":""70 Watogodziny"",""Liczba baterii litowo-jonowych"":""1"",""ASIN"":""B0CMZLPZP1"",""Gwarantowane aktualizacje oprogramowania do"":""nieznany(-na)""}"
"HP Pavilion Laptop 15-eg2327nw | 15.6"" Full HD | Intel Core i5-1235U | 16GB RAM | 1TB SSD | Windows 11 Home | QWERTY Keyboard (Polski)",3499,https://www.amazon.pl/HP-Pavilion-15-eg2327nw-i5-1235U-Keyboard/dp/B0CLS49YJX,B0CLS49YJX,"Rób swoje, gdziekolwiek jesteś, na kompaktowym laptopie HP Pavilion 15. Procesor Intel i precyzyjna płytka dotykowa pozwalają sprawnie wykonać każde zadanie. Zapewnij sobie ciągłość pracy, dzięki długiemu czasowi pracy na akumulatorze w połączeniu z funkcją HP Fast Charge. Podkręć rozrywkę dzięki systemowi audio firmy B&O i ekranowi pozbawionemu migotania.","",Liczba ocen: 3,Liczba dostępnych szt.: 7. Zapasy zostaną niedługo uzupełnione.,,"Dynamiczny procesor, który dostosowuje się do Ciebie, zapewniając doskonałą wydajność wielozadaniową|Wyświetlacz FHD z technologią IPS|Karta graficzna Intel Iris Xᵉ","{""Marka"":""HP"",""Producent"":""HP"",""Seria"":""Pavilion"",""Wymiary opakowania"":""48,2 x 30,4 x 7 cm; 2,42 kg"",""Baterie:"":""1 Specyfikacja produktu (w zestawie)"",""Numer modelu"":""15-eg2327nw"",""Kolor"":""Silver"",""Kształt"":""Laptop"",""Rozmiar wyświetlacza stojącego"":""15,6 Cale"",""Rozdzielczość wyświetlania"":""1920 x 1080 pixels"",""Rozdzielczość"":""1920x1080"",""Marka procesora"":""Intel"",""Typ procesora"":""Core i5"",""Szybkość procesora"":""4.4"",""Liczba procesorów"":""1"",""RAM"":""16 GB"",""Technologia pamięci"":""DDR4"",""Rodzaj pamieci komputera"":""SODIMM"",""Maksymalna ilość obsługiwanej pamięci"":""16 GB"",""Pojemność dysku twardego"":""1 TB"",""Opis dysku twardego"":""SSD"",""Interfejs dysku twardego"":""Serial ATA"",""Szczegóły audio"":""internal"",""GPU"":""Intel"",""Opis karty graficznej"":""Zintegrowana"",""Typ pamięci RAM karty graficznej"":""DDR SDRAM"",""Interfejs karty graficznej"":""Zintegrowane"",""Technologia komunikacji bezprzewodowej"":""Wi-fi"",""Typ bezprzewodowy"":""802.11n"",""Liczba portów USB 3.0"":""2"",""Napięcie"":""240 Wolty"",""System operacyjny"":""Windows 11 Home"",""Czy baterie są dołączone"":""Tak"",""Pojemność akumulatora litowego"":""41 Watogodziny"",""Liczba baterii litowo-jonowych"":""3"",""ASIN"":""B0CLS49YJX"",""Gwarantowane aktualizacje oprogramowania do"":""nieznany(-na)""}"
"ACEMAGIC Gaming Notebook AMD Ryzen 7 5825U(Bbatti7-1355U), podświetlana klawiatura laptopa, pamięć RAM 16 GB NVME SSD 512 GB, Win 11 Pro Laptop, 16,1"" Full HD 1920 x 1080, kolor (szary)",2475,https://www.amazon.pl/ACEMAGIC-Notebook-Bbatti7-1355U-pod%C5%9Bwietlana-klawiatura/dp/B0D95VPM4M,B0D95VPM4M,"","",Liczba ocen: 125,Dostępny,RMZAO,"【GIER I ELITE WSZĘDZIE】 Procesor AMD Ryzen 7 5825U wykracza poza wydajność, dzięki czemu laptop może robić jeszcze więcej jednocześnie. Uzyskaj wydajność potrzebną do grania w gry z dużą liczbą klatek na sekundę i bez wysiłku przełączaj się na duże obciążenia wielozadaniowe, takie jak wideo, muzyka i edycja zdjęć.|【16 GB DDR4 512 GB SSD】Laptop jest wyposażony w 16 GB DDR4, który ma więcej miejsca i jest o 50% szybszy niż w przypadku komputerów wyposażonych w DDR3. Wbudowany dysk SSD M.2 512 GB (rozszerzenie 2TB), wystarczająco dużo miejsca, aby zapewnić płynny system, zapisując wiele osobistych plików. Obsługuje rozszerzenie karty TF 128 GB. Laptop z fabrycznie zainstalowanym systemem operacyjnym, gotowy do użycia i gotowy do użycia po wstępnej konfiguracji systemu.|【Wrażenia wizualne HD】16,1-calowy laptop z ekranem Full HD o rozdzielczości 1920 x 1080, jasny wyświetlacz o wysokiej rozdzielczości. Ultracienka konstrukcja ramy o grubości 7 mm, wymiary zaledwie 368 mm (szer.) x 230 mm (szer.) x 18,7 mm (wys.), waga tylko 1,8 kg, dzięki czemu można ją zabrać ze sobą.|PODŚWIETLONA KLAWIATURA: Ciesz się wygodnym i precyzyjnym pisaniem nawet przy słabym oświetleniu.|Długa żywotność baterii: bateria o pojemności 6000 mAh/53 Wh od wschodu do zachodu słońca może zapewnić do 6-8 godzin pracy bez obaw|Bezproblemowa obsługa klienta: ten cienki laptop można łatwo włożyć do plecaka, aby zabrać go ze sobą wszędzie. Z płaskim zamkiem błyskawicznym, który umożliwia obrót laptopa o 180°. Metalowa obudowa została zaprojektowana tak, aby wytrzymać nacisk i uderzenia. ACEMAGIC zapewnia 12-miesięczną pomoc techniczną dla klientów. Jeśli masz jakiekolwiek pytania dotyczące użytkowania, skontaktuj się z nami","{""Marka"":""ACEMAGIC"",""Producent"":""ACEMAGIC"",""Seria"":""AX16PRO"",""Wymiary produktu"":""34,7 x 24,7 x 1,7 cm; 2,98 kg"",""Baterie:"":""1 C (w zestawie)"",""Numer modelu"":""AX16PRO"",""Kolor"":""Szary"",""Kształt"":""Laptop"",""Rozmiar wyświetlacza stojącego"":""16,1 Cale"",""Rozdzielczość wyświetlania"":""1920 x 1080 pixels"",""Rozdzielczość"":""1080p Full HD Piksele"",""Marka procesora"":""AMD"",""Typ procesora"":""AMD Ryzen 7"",""Szybkość procesora"":""4,3 GHz"",""Liczba procesorów"":""8"",""RAM"":""16 GB"",""Rodzaj pamieci komputera"":""DDR4 SDRAM"",""Maksymalna ilość obsługiwanej pamięci"":""16 GB"",""Pojemność dysku twardego"":""512 GB"",""Opis dysku twardego"":""SSD"",""Interfejs dysku twardego"":""USB 3.0"",""Szczegóły audio"":""Słuchawki"",""Koprocesor graficzny"":""AMD Radeon™ Graphics"",""GPU"":""AMD"",""Opis karty graficznej"":""Zintegrowana"",""Typ pamięci RAM karty graficznej"":""Współdzielona"",""Interfejs karty graficznej"":""Zintegrowane"",""Technologia komunikacji bezprzewodowej"":""Uniseks"",""Platforma sprzętowa"":""Komputer"",""System operacyjny"":""DOS"",""Średni czas pracy baterii"":""8 Godziny"",""Czy baterie są dołączone"":""Tak"",""Pojemność akumulatora litowego"":""4 Miliamperogodzina (mAh)"",""Waga akumulatora litowego"":""200 Gramy"",""Liczba baterii litowo-jonowych"":""1"",""ASIN"":""B0D95VPM4M"",""Gwarantowane aktualizacje oprogramowania do"":""nieznany(-na)""}"
"Kompatybilny model HP NOTEBOOK HP 240 G10 14"" i5-1335U 3,4 GHz RAM 16 GB SSD 1000 GB NVMe-WI-FI 6-WIN 11 PROF (8A5M2EA #ABZ)",2438,https://www.amazon.pl/Kompatybilny-HP-NOTEBOOK-i5-1335U-NVMe-WI-FI/dp/B0CT5XXHZP,B0CT5XXHZP,"Kompatybilny model HP NOTEBOOK HP 240 G10 14"" i5-1335U 3,4 GHz RAM 16 GB SSD 1000 GB NVMe-WI-FI 6-WIN 11 PROF (8A5M2EA #ABZ) i numer referencyjny 398180","","Liczba gwiazdek: 5
0%",Dostępny,,"Laptop|Model: HP 240 G10 14"" i5-1335U|Modny i stylowy design","{""Marka"":""HP"",""Producent"":""HP"",""Seria"":""HP 240 G10"",""Wymiary opakowania"":""45 x 30,7 x 6,9 cm; 2,1 kg"",""Numer modelu"":""398180"",""Kolor"":""Biały,"",""Rozmiar wyświetlacza stojącego"":""14 Cale"",""Marka procesora"":""Intel"",""Typ procesora"":""Core i5-7360U"",""Szybkość procesora"":""3,4 GHz"",""Liczba procesorów"":""1"",""RAM"":""16"",""Rodzaj pamieci komputera"":""DDR4 SDRAM"",""Pojemność dysku twardego"":""1000 GB"",""Opis dysku twardego"":""1000GB NVMe SSD"",""Technologia komunikacji bezprzewodowej"":""Wi-fi"",""Typ bezprzewodowy"":""802.11.ax"",""System operacyjny"":""Windows 11 Pro"",""ASIN"":""B0CT5XXHZP"",""Gwarantowane aktualizacje oprogramowania do"":""nieznany(-na)""}"
"Notebook Asus ZenBook 14 UM3402YA-KM512WS 7730U AMD Ryzen 7 512 GB SSD 14"" 16 GB SSD AMD Ryzen 7 GB SSD Windows 10 Pro",3967,https://www.amazon.pl/Notebook-ZenBook-UM3402YA-KM512WS-7730U-Windows/dp/B0C82TS278,B0C82TS278,"Jeśli pasjonujesz się komputerami i elektroniką, lubisz być w najnowszej technologii i nie przegapić szczegółów, kup Notebook Asus ZenBook 14 OLED UM3402YA-KM512WS AMD Ryzen 7 7730U 512 GB SSD 14"" 16 GB RAM w najlepszej cenie. Kolor: Czarny Cechy: Podświetlany Podłączanie słuchawek Wbudowany mikrofon Czytnik kart Czytnik linii papilarnych Wbudowany adapter graficzny Połączenia: HDMI USB-C USB 3.2 PCI Express 3.0 HDMI 2.1 x 1 USB C 3.2 Gen 2 (3.1 Gen 2) USB A 3.2 Gen 2 (3.1 Gen 2) x 1 Gen Łączność: Bluetooth Wi-Fi 6 GHz Bluetooth 5.0 Pamięć RAM: 16 GB RAM Dysk twardy: 512 GB SSD Typ ekranu: 14"" Model: DDR4 Przednia kamera Notebook SSD Gloss System operacyjny: Windows 11 Home Rodzina procesorów: AMD Ryzen 7 AMD Rozdzielczość (px): 2880 x 180 px Produkt z wtyczką e: Tak Typ Wtyczka zasilania: Wtyczka EU Klawiatura: Qwerty Hiszpański Materiały: Aluminium Format obrazu: 16:10 Rozdzielczość: Full HD 2880 x 1800 px Prędkość: 2 GHz 90 Hz Napięcie operacyjne: 20 V Cache: 16 MB Karta graficzna: AMD Radeon Graphics No Źródło zasilania: USB Częstotliwość: 50 - 6 0 Hz 4,5 5 GHz Moc: 65 W Napięcie: 100 - 240 V Nie zawiera: Napędy optyczne Klawiatura numeryczna Połączenie z siecią komórkową Model dedykowanej karty graficznej Wymagania: 64-bitowy Format nośnika (podajnik 1): M.2 1 x 16 GB Ethernet: Nie Bateria Litowo-polimerowa (Li-Ionowa) Współczynnik lm Kształt: On-board Clamshell Obsługiwane typy kart pamięci: MicroSD (TransFlash) Złącze(a): TPM Typ anteny: 2 x 2 Wzglęcie: 3,25 A Rekomendowane użycie: Dom Zawiera: SSD x 1 Rodzaj baterii: Litowo-jonowa rdzenia: 8 Rdzenie Typ pamięci: LPDDR4x-SDRAM Przekątna wyświetlaczu (cm): 35,6 Procesor: AMM D Ryzen 7730U","","Liczba gwiazdek: 5
0%",Dostępne sztuki: 6 – zamów teraz.,,"Notatnik marki Asus|Kolor: wielokolorowy|Wymiary: 7,5 x 41 x 28,4 cm|Odniesienie: S7824272|Jeśli szukasz jakości w najlepszej cenie, nie szukaj dalej!","{""Marka"":""ASUS"",""Producent"":""Asus"",""Seria"":""ZenBook 14"",""Wymiary produktu"":""7,5 x 41 x 28,4 cm; 1,39 kg"",""Kolor"":""Różne kolory"",""Kształt"":""Laptop"",""Rozmiar wyświetlacza stojącego"":""14 Cale"",""Rozdzielczość wyświetlania"":""1920 x 1080 píxeles"",""Rozdzielczość"":""1920 x 1080 píxeles"",""Marka procesora"":""AMD"",""Liczba procesorów"":""1"",""RAM"":""16 GB"",""Rodzaj pamieci komputera"":""DDR4 SDRAM"",""Pojemność dysku twardego"":""512 GB"",""Opis dysku twardego"":""SSD"",""Interfejs dysku twardego"":""Ethernet"",""Koprocesor graficzny"":""Radeón Gráficos"",""Opis karty graficznej"":""Zintegrowana"",""Technologia komunikacji bezprzewodowej"":""Bluetooth"",""Typ bezprzewodowy"":""Bluetooth"",""Liczba portów HDMI"":""1"",""Liczba portów Ethernet"":""1"",""Napięcie"":""100 Wolty"",""System operacyjny"":""Windows 10 Pro"",""ASIN"":""B0C82TS278"",""Gwarantowane aktualizacje oprogramowania do"":""nieznany(-na)""}"
"MSI Thin A15 B7UC-048IT Gaming do notebooków 15,6"" Full HD 144 Hz, AMD Ryzen 5 7535HS, Nvidia RTX 3050 4GB GDDR6, 16 GB DDR5 RAM, 512 GB SSD PCIe4, WiFi 6E, Windows 11 Home [układ i",3850,https://www.amazon.pl/MSI-B7UC-048IT-Gaming-notebook%C3%B3w-Windows/dp/B0CT457WVS,B0CT457WVS,"MSI Laptop A15 B7UC-048IT 15,6"" Full HD (GPU NVIDIA RTX 3050, AMD Ryzen 5 7535HS, DDR5 8 GB, Windows 11) szary, podświetlana niebieska klawiatura z układem włoskim.","",Liczba ocen: 466,Dostępny,,"Thin A15 jest odpowiednim towarzyszem Twojej podróży; doskonała cienka rama jest teraz dostępna w nowym kosmosowym szarym kolorze i zaktualizowanym sprzęcie; wykorzystaj moc i doświadczaj świata gier swobodnie i szybko dzięki Thin A15|DOSKONAŁY STANDARD DO GRY: Witamy w doskonałej erze wydajności; seria AMD Ryzen 7535HS wprowadza prędkość Zen 3+ dla graczy i twórców z czystą mocą do radzenia sobie z każdą grą; z maksymalnie 8 rdzeniami i 16 wątkami|GPU NVIDIA RTX 3050 Laptop GPU są wykonane z Ampere, architektury RTX drugiej generacji firmy NVIDIA, aby zapewnić najbardziej realistyczną grafikę ray tracingu i najnowocześniejsze funkcje AI, takie jak NVIDIA DLSS|POSTAŃ ŚWIEŻY I CICHY Pod obciążeniem: Zoptymalizowany tak, aby był zauważalnie cichszy i chłodniejszy pod obciążeniem, łatwo dostosowując się do każdego środowiska|Laptopy MSI mają 2 lata , nawet jeśli są kupowane za pośrednictwem VAT!","{""Marka"":""MSI"",""Producent"":""MSI"",""Seria"":""Thin A15 B7UC-048IT"",""Wymiary opakowania"":""46,6 x 37,2 x 8,7 cm; 1,86 kg"",""Baterie:"":""1 Litowo-polimerowa"",""Numer modelu"":""9S7-16RK11-048"",""Kolor"":""Czarny"",""Kształt"":""Laptop"",""Rozmiar wyświetlacza stojącego"":""15,6 Cale"",""Rozdzielczość wyświetlania"":""1920 x 1080 pixels"",""Rozdzielczość"":""1920x1080 Piksele"",""Marka procesora"":""AMD"",""Typ procesora"":""Ryzen 5"",""Szybkość procesora"":""3,3 GHz"",""Liczba procesorów"":""1"",""RAM"":""16"",""Rodzaj pamieci komputera"":""DDR5 RAM"",""Maksymalna ilość obsługiwanej pamięci"":""64 GB"",""Prędkość zegara pamięci"":""4800 GHz"",""Pojemność dysku twardego"":""512 GB"",""Opis dysku twardego"":""SSD"",""Interfejs dysku twardego"":""PCIE x 4"",""Szczegóły audio"":""Głośniki, Słuchawki"",""GPU"":""NVIDIA"",""Opis karty graficznej"":""RTX 3050"",""Typ pamięci RAM karty graficznej"":""GDDR6"",""Rozmiar pamięci RAM karty graficznej"":""4 GB"",""Interfejs karty graficznej"":""PCI-Express x4, PCI Express"",""Technologia komunikacji bezprzewodowej"":""Bluetooth"",""Typ bezprzewodowy"":""802.11.ax"",""Liczba portów USB 3.0"":""3"",""Liczba portów HDMI"":""1"",""Liczba portów Ethernet"":""1"",""System operacyjny"":""Windows 11"",""Pojemność akumulatora litowego"":""52,4 Watogodziny"",""Liczba baterii litowo-jonowych"":""3"",""ASIN"":""B0CT457WVS"",""Gwarantowane aktualizacje oprogramowania do"":""nieznany(-na)""}"
"Acer Aspire 3 NX.KDEEH.00E Laptop, AMD Ryzen 5 7520U, 8GB RAM, 512GB SSD, AMD Radeon 610m, Windows 11, qwerty, Srebrny, 15,6 """,2609,https://www.amazon.pl/Acer-Aspire-NX-KDEEH-00E-Windows-Srebrny/dp/B0BTPNXZW7,B0BTPNXZW7,"Połączenie innowacyjnej technologii, niezawodności i eleganckiego designu. Dzięki najnowszym procesorom oraz wyjątkowym ekranom zapewniają płynność i wydajność w każdym zadaniu. Precyzyjna konstrukcja oraz trwałe materiały sprawiają, że są idealnym narzędziem do pracy, nauki i rozrywki. ACER to pewność wyboru sprzętu, który spełni Twoje oczekiwania.","",Liczba ocen: 2,Dostępny,,Zaawansowany procesor pozwalający na szybką i płynną pracę w aplikacjach i grach|Ostry obraz i precyzyjne odwzorowanie kolorów|Elegancki design łączy się z solidną konstrukcją,"{""Marka"":""acer"",""Producent"":""Acer"",""Seria"":""Aspire 3"",""Wymiary opakowania"":""50,1 x 31 x 6,7 cm; 1,8 kg"",""Baterie:"":""1 Litowo-jonowa (w zestawie)"",""Numer modelu"":""NX.KDEEH.00E"",""Kolor"":""Srebrny"",""Kształt"":""Laptop"",""Rozmiar wyświetlacza stojącego"":""15,6 Cale"",""Rozdzielczość wyświetlania"":""1920 x 1080 pixels"",""Marka procesora"":""AMD"",""Liczba procesorów"":""1"",""RAM"":""8 GB"",""Rodzaj pamieci komputera"":""DDR5 RAM"",""Maksymalna ilość obsługiwanej pamięci"":""16 GB"",""Pojemność dysku twardego"":""512 GB"",""Opis dysku twardego"":""SSD"",""Szczegóły audio"":""Słuchawki"",""GPU"":""AMD"",""Opis karty graficznej"":""Zintegrowana"",""Typ pamięci RAM karty graficznej"":""Współdzielona"",""Interfejs karty graficznej"":""Zintegrowane"",""Technologia komunikacji bezprzewodowej"":""Wi-fi"",""Typ bezprzewodowy"":""802.11.ax, Bluetooth"",""Liczba portów HDMI"":""1"",""Liczba portów Ethernet"":""1"",""Napięcie"":""220 Wolty"",""Moc w watach"":""45 W"",""Typ napędu optycznego"":""geen"",""Rozdzielczość przedniej kamery internetowej"":""1 MP"",""System operacyjny"":""Windows 11 Home"",""Średni czas pracy baterii"":""5,5 Godziny"",""Czy baterie są dołączone"":""Tak"",""ASIN"":""B0BTPNXZW7"",""Gwarantowane aktualizacje oprogramowania do"":""nieznany(-na)""}"
"HP Laptop 15-fd0147nw | 15.6"" Full HD | Intel Core i5-1335U | 16GB RAM | 512GB SSD | Windows 11 Home | QWERTY Keyboard (Polski)",2799,https://www.amazon.pl/HP-15-fd0147nw-i5-1335U-Windows-Keyboard/dp/B0CLS34JWC,B0CLS34JWC,"Laptop HP 15,6 pozwala zrobić więcej, dzięki niezawodnej mocy procesora Intel, dużej pamięci masowej i wydajnej karcie graficznej w smukłym, przemyślnie zaprojektowanym urządzeniu. Ten komputer, stworzony z myślą o pracy w dowolnym miejscu oraz wykonany z tworzyw sztucznych odzyskanych przed trafieniem do oceanu i pochodzących z recyklingu pokonsumenckiego, pozwala w prosty sposób okazać trochę miłości dla naszej planety.","","Liczba gwiazdek: 5
0%",Dostępne sztuki: 2 – zamów teraz.,,Eliminacja migotania obrazu|Pełnowymiarowa klawiatura ze zintegrowaną klawiaturą numeryczną|Technologia HP Fast Charge|Podświetlana klawiatura,"{""Marka"":""HP"",""Producent"":""HP"",""Seria"":""15-fd0147nw"",""Wymiary opakowania"":""48,2 x 30,7 x 6,9 cm; 2,13 kg"",""Baterie:"":""1 Specyfikacja produktu (w zestawie)"",""Numer modelu"":""15-fd0147nw"",""Kolor"":""Srebrny"",""Rozmiar wyświetlacza stojącego"":""15,6 Cale"",""Rozdzielczość wyświetlania"":""1920 x 1080 pixels"",""Rozdzielczość"":""1920x1080"",""Marka procesora"":""Intel"",""Typ procesora"":""Core i5"",""Szybkość procesora"":""4.6"",""Liczba procesorów"":""1"",""RAM"":""16 GB"",""Technologia pamięci"":""DDR4"",""Rodzaj pamieci komputera"":""SODIMM"",""Maksymalna ilość obsługiwanej pamięci"":""64 GB"",""Pojemność dysku twardego"":""512 GB"",""Opis dysku twardego"":""SSD"",""Koprocesor graficzny"":""Intel Iris Xe Graphics"",""GPU"":""Intel"",""Opis karty graficznej"":""Zintegrowana"",""Typ pamięci RAM karty graficznej"":""DDR SDRAM"",""Interfejs karty graficznej"":""Zintegrowane"",""Typ bezprzewodowy"":""802.11n"",""Liczba portów USB 3.0"":""3"",""System operacyjny"":""Windows 11 Home"",""Czy baterie są dołączone"":""Tak"",""Pojemność akumulatora litowego"":""41 Watogodziny"",""Liczba baterii litowo-jonowych"":""3"",""ASIN"":""B0CLS34JWC"",""Gwarantowane aktualizacje oprogramowania do"":""nieznany(-na)""}"
"Hp Pavilion 15-eg2650nd Laptop, Intel Core i5-1235U, 8GB RAM, 512GB SSD, Grafika zintegrowana, Windows OS, qwerty, Srebrny, 15,6 """,2763,https://www.amazon.pl/Pavilion-15-eg2650nd-i5-1235U-Grafika-zintegrowana/dp/B0B4DV3T6R,B0B4DV3T6R,"Połączenie innowacyjnej technologii, niezawodności i eleganckiego designu. Dzięki najnowszym procesorom oraz wyjątkowym ekranom zapewniają płynność i wydajność w każdym zadaniu. Precyzyjna konstrukcja oraz trwałe materiały sprawiają, że są idealnym narzędziem do pracy, nauki i rozrywki. HP to pewność wyboru sprzętu, który spełni Twoje oczekiwania.","",Liczba ocen: 1,Dostępny,,Zaawansowany procesor pozwalający na szybką i płynną pracę w aplikacjach i grach|Ostry obraz i precyzyjne odwzorowanie kolorów|Elegancki design łączy się z solidną konstrukcją,"{""Marka"":""HP0Q5"",""Producent"":""HP"",""Seria"":""Pavilion"",""Wymiary produktu"":""36,02 x 23,4 x 1,79 cm; 2,43 kg"",""Baterie:"":""1 Litowo-jonowa (w zestawie)"",""Numer modelu"":""15-eg2650nd"",""Kolor"":""Srebrny"",""Kształt"":""Tradycyjna klapka"",""Rozmiar wyświetlacza stojącego"":""15,6 Cale"",""Rozdzielczość wyświetlania"":""1920 x 1080 pixels"",""Rozdzielczość"":""1920x1080"",""Liczba procesorów"":""10"",""RAM"":""8 GB"",""Rodzaj pamieci komputera"":""DDR4 SDRAM"",""Maksymalna ilość obsługiwanej pamięci"":""8 GB"",""Pojemność dysku twardego"":""512 GB"",""Opis dysku twardego"":""SSD"",""Opis karty graficznej"":""Zintegrowana"",""Interfejs karty graficznej"":""Zintegrowane"",""Typ bezprzewodowy"":""802.11ac"",""Liczba portów USB 2.0"":""1"",""Napięcie"":""19,5 Wolty"",""Czy baterie są dołączone"":""Tak"",""Pojemność akumulatora litowego"":""41 Watogodziny"",""Liczba baterii litowo-jonowych"":""3"",""Język"":""Holenderski"",""ASIN"":""B0B4DV3T6R"",""Gwarantowane aktualizacje oprogramowania do"":""nieznany(-na)""}"
