Tytuł,Cena,URL,ASIN,Opis,Ocena,Liczba opinii,Dostępność,Sprzedawca,Cechy,Szczegóły techniczne
"TULPAR T5 V23.4.3 laptop gamingowy | wyświetlacz LED 15,6"" FHD 1920 x 1080 144 Hz IPS | Intel Core i7 12700H | 16 GB RAM | 1 TB SSD | Nvidia RTX 4060 | FreeDOS | Notebook gamingowy",3953,https://www.amazon.pl/TULPAR-V23-4-3-gamingowy-wy%C5%9Bwietlacz-Notebook/dp/B0D2R7R3NQ,B0D2R7R3NQ,"Informacje o tym produkcie
Ciesz się imponującą wydajnością procesora Intel Core i7 12700H w naszym laptopie dla graczy TULPAR Ten procesor został zaprojektowany specjalnie do intensywnych gier i zapewnia niesamowitą szybkość i szybkość reakcji. Zanurz się w płynnej rozgrywce, które są możliwe tylko dzięki wyjątkowej wydajności tego procesora. Przygotuj się na przeniesienie sesji gier na wyższy poziom!
Dzięki 16 GB pamięci RAM i dyskowi SSD 1 TB ten notebook gamingowy TULPAR zapewnia wystarczająco dużo miejsca na wszystkie gry i aplikacje.
Notebook gamingowy TULPAR jest wyposażony w imponujący wyświetlacz LED 15,6"" FHD 144HZ IPS, który zapewnia intensywne i wciągające wrażenia podczas gry. Wysoka częstotliwość odświeżania 144 Hz zapewnia płynny ruch i wyostrza szczegóły, dzięki czemu możesz cieszyć się grami w najwyższej jakości. Technologia IPS zapewnia ponadto szeroki kąt widzenia i żywe kolory. Przygotuj się na ożywienie swoich gier na tym wspaniałym wyświetlaczu!
Notebook gamingowy TULPAR oferuje w pełni podświetlaną klawiaturę QWERTZ, która została zaprojektowana specjalnie dla graczy. Oświetlenie RGB można indywidualnie dopasować, dzięki czemu możesz zaprojektować klawiaturę zgodnie z życzeniem. Układ QWERTZ jest idealny dla niemieckich użytkowników i zapewnia wygodne i wydajne pisanie. Ciesz się nocnymi sesjami gier dzięki jasnemu i kolorowemu oświetleniu naszej klawiatury do gier!","",Liczba ocen: 52,Dostępny,TULPAR GAMING NOTEBOOK,"Ciesz się imponującą wydajnością procesora Intel Core i7 12700H w naszym laptopie dla graczy TULPAR Ten procesor został zaprojektowany specjalnie do intensywnych gier i zapewnia niesamowitą szybkość i szybkość reakcji. Zanurz się w płynnej rozgrywce, które są możliwe tylko dzięki wyjątkowej wydajności tego procesora. Przygotuj się na przeniesienie sesji gier na wyższy poziom!|Dzięki 16 GB pamięci RAM i dyskowi SSD 1 TB ten notebook gamingowy TULPAR zapewnia wystarczająco dużo miejsca na wszystkie gry i aplikacje.|Notebook gamingowy TULPAR jest wyposażony w imponujący wyświetlacz LED 15,6"" FHD 144HZ IPS, który zapewnia intensywne i wciągające wrażenia podczas gry. Wysoka częstotliwość odświeżania 144 Hz zapewnia płynny ruch i wyostrza szczegóły, dzięki czemu możesz cieszyć się grami w najwyższej jakości. Technologia IPS zapewnia ponadto szeroki kąt widzenia i żywe kolory. Przygotuj się na ożywienie swoich gier na tym wspaniałym wyświetlaczu!|Notebook gamingowy TULPAR oferuje w pełni podświetlaną klawiaturę QWERTZ, która została zaprojektowana specjalnie dla graczy. Oświetlenie RGB można indywidualnie dopasować, dzięki czemu możesz zaprojektować klawiaturę zgodnie z życzeniem. Układ QWERTZ jest idealny dla niemieckich użytkowników i zapewnia wygodne i wydajne pisanie. Ciesz się nocnymi sesjami gier dzięki jasnemu i kolorowemu oświetleniu naszej klawiatury do gier!","{""Marka"":""TULPAR"",""Producent"":""Tulpar"",""Seria"":""T5 V23.2 Series"",""Wymiary opakowania"":""50 x 41 x 15 cm; 5 kg"",""Rozmiar wyświetlacza stojącego"":""15,6 Cale"",""Rozdzielczość wyświetlania"":""1920 x 1080 pixels"",""Rozdzielczość"":""1920x1080"",""Marka procesora"":""Intel"",""Typ procesora"":""Intel Core i7"",""Szybkość procesora"":""2,3 GHz"",""Liczba procesorów"":""14"",""Rodzaj pamieci komputera"":""DDR4 SDRAM"",""Maksymalna ilość obsługiwanej pamięci"":""64 GB"",""Pojemność dysku twardego"":""1E+3 GB"",""Opis dysku twardego"":""SSD"",""Szczegóły audio"":""słuchawki, głośniki"",""Koprocesor graficzny"":""NVIDIA GeForce RTX 4060"",""GPU"":""NVIDIA"",""Opis karty graficznej"":""Dedykowana"",""Typ pamięci RAM karty graficznej"":""GDDR6"",""Interfejs karty graficznej"":""PCI-Express x8"",""Technologia komunikacji bezprzewodowej"":""Wi-fi"",""Liczba portów USB 2.0"":""1"",""Liczba portów USB 3.0"":""1"",""Typ napędu optycznego"":""No"",""System operacyjny"":""Windows 11 Home"",""Czy baterie są dołączone"":""Nie"",""ASIN"":""B0D2R7R3NQ"",""Gwarantowane aktualizacje oprogramowania do"":""nieznany(-na)""}"
"Notebook HP i5 250 G7 Przenośny wyświetlacz Full HD 15.6"" procesor Intel Quad core i5-1035G7 1,6 GHz do 3,7 Ghz /Ram 8 Gb DDR4 /SSD M2 512GB /VGA INTEL UHD /Hdmi Dvd Rw Wifi Bluetooth /Windows 10 plusy",2550,https://www.amazon.pl/HP-Przeno%C5%9Bny-wy%C5%9Bwietlacz-i5-1035G7-Bluetooth/dp/B07YZNJT9X,B07YZNJT9X,"Pozostań w kontakcie dzięki laptopowi HP 250, który jest wyposażony w najnowszą technologię i jest chroniony solidną obudową. Wykonaj każdą pracę dzięki procesorom Intel1 i szeregowi niezbędnych narzędzi do współpracy. Rozwijaj każdy projekt dzięki najbardziej zaawansowanej technologii, w tym potężnym procesorom Intel Core1 oraz opcjom pamięci i pamięci masowej HP 250 jest idealnym rozwiązaniem do pracy w ruchu, dzięki cieńszej i lżejszej konstrukcji. Solidna obudowa chroni notebooka dzięki profesjonalnemu wyglądowi odpowiedni dla Twojej firmy. Procesor Intel Core dziesiątej generacji pozwala pracować z maksymalną wydajnością nawet w najbardziej zaawansowanych aplikacjach profesjonalnych.","",Liczba ocen: 35,Dostępne sztuki: 5 – zamów teraz.,RGDIGITAL,"HP LED 15,6"" - procesor Intel i5-1035G7 10th gen - karta graficzna Intel uhd (minimalna częstotliwość przy 1,70 GHz, 4 rdzenie przy 3,7 GHz)|SSD M2 512 GB nvme - Nagrywarka DVD - DDR4 8GB 2666mhz|przychody / 2x USB 3.0 - 1x USB 2.0 - 1x HDMI - 1x RJ-45 - 1x combo słuchawki mikrofonowe - 1x zasilacz sieciowy - 1x cyfrowy czytnik kart SD - Klawiatura qwerty z klawiaturą numeryczną i klawiszami wyspowymi|Wifi :Dual Band Wireless 802.11a - Bluetooth 4.2 - przeciwodblaskowy wyświetlacz FHD SVA z podświetleniem WLED o przekątnej 39,6 cm - Rozdzielczość ekranu 1920 x 1080 Max - Kamera HP Vga|LICENCJA WINDOWS 10 PROFESSIONAL 64 BIT ORYGINALNY Digital Key (bez DVD) - 2-letnia gwarancja RGDIGITAL- Otwarty i ponownie zamknięty przez nas w celu zainstalowania ulepszonych (Ram i SSD) i programów (Win10)","{""Marka"":""HP"",""Producent"":""RGDIGITAL SRL"",""Seria"":""250 G7"",""Wymiary produktu"":""24,6 x 37,6 x 2,2 cm; 2 kg"",""Numer modelu"":""HP"",""Wycofane przez producenta"":""Nie"",""Kolor"":""HP I5 RAM 8GB SSD512 W10"",""Kształt"":""Laptop"",""Rozmiar wyświetlacza stojącego"":""1 Centymetry"",""Technologia wyświetlacza notebooka"":""LED"",""Rozdzielczość wyświetlania"":""1920 x 1080 pixels"",""Rozdzielczość"":""1080p Full HD"",""Marka procesora"":""Intel"",""Gniazdo procesora"":""intel i5"",""Liczba procesorów"":""2"",""RAM"":""8 GB"",""Rodzaj pamieci komputera"":""DDR4 SDRAM"",""Prędkość zegara pamięci"":""2666 MHz"",""Pojemność dysku twardego"":""256 GB"",""Interfejs dysku twardego"":""Stan sały"",""Koprocesor graficzny"":""INTEL UHD"",""GPU"":""Intel"",""Opis karty graficznej"":""Intel UHD"",""Typ pamięci RAM karty graficznej"":""GDDR4"",""Technologia komunikacji bezprzewodowej"":""Bluetooth"",""Typ bezprzewodowy"":""Bluetooth, 802.11a"",""Liczba portów Ethernet"":""1"",""Typ napędu optycznego"":""DVD/CD"",""Rodzaj źródła zasilania"":""ac & battery"",""Platforma sprzętowa"":""Windows"",""System operacyjny"":""Windows 11"",""Czy baterie są dołączone"":""Nie"",""ASIN"":""B07YZNJT9X"",""Gwarantowane aktualizacje oprogramowania do"":""nieznany(-na)""}"
"Lenovo ThinkPad E14 G6 21M3002BGE - 14"" WUXGA, Ryzen 5 7535HS, 16GB, 512GB, Windows 11 Pro",3340,https://www.amazon.pl/Lenovo-ThinkPad-E14-G6-21M3002BGE/dp/B0D58M8ZDL,B0D58M8ZDL,"Lenovo ThinkPad E14 G6 21M3002BGE - 14"" WUXGA, Ryzen 5 7535HS, 16GB, 512GB, Windows 11 Pro","",Liczba ocen: 1,Gotowe do wysyłki w ciągu 1–2 dni,,21M3002BGE,"{""Marka"":""Lenovo"",""Model"":""LDPAKM1011SPEAKGRE"",""Wymiary opakowania"":""44,7 x 30 x 8,2 cm; 2,46 kg"",""Funkcje specjalne"":""TrackPoint, klawiatura z podświetleniem tła"",""Producent"":""Lenovo"",""Numer modelu"":""21M3002BGE"",""ASIN"":""B0D58M8ZDL""}"
HP 15-fd0729nw i3-N305 15.6 FHD 8GB DDR4 3200 SSD256 Intel UHD Graphics Win11 2Y Moonlight Blue,2059,https://www.amazon.pl/15-fd0729nw-i3-N305-SSD256-Graphics-Moonlight/dp/B0DF5Q8ZJ8,B0DF5Q8ZJ8,HP 15-fd0729nw i3-N305 15.6 FHD 8GB DDR4 3200 SSD256 Intel UHD Graphics Win11 2Y Moonlight Blue,"","Liczba gwiazdek: 5
0%",Dostępne sztuki: 5 – zamów teraz.,,9Z2F2EA,"{""Marka"":""Hewlett-Packard"",""Model"":""9Z2F2EA"",""Wymiary produktu"":""31 x 48,5 x 7,5 cm; 1,07 kg"",""Funkcje specjalne"":""Podświetlana klawiatura"",""Producent"":""Hewlett-Packard"",""Numer modelu"":""9Z2F2EA"",""ASIN"":""B0DF5Q8ZJ8""}"
"Acer Laptop z komputerem przenośnym, Extensa 15, procesor i5-1135G7 4-rdzeniowy, pamięć RAM 20 GB SSD 1000 GB, 15,6"" FHD IPS, karta graficzna Intel Iris Xe, Windows 11 Pro, gotowy do użycia, Gar,",2686,https://www.amazon.pl/komputerem-przeno%C5%9Bnym-i5-1135G7-4-rdzeniowy-graficzna/dp/B08668ZRY5,B08668ZRY5,"Opis produktu
Zaprojektowany z myślą o codziennej wydajności i funkcjonalności biznesu notebooki Extensa 15 są wyposażone w cały dzień pracy, nawet 9-godzinny czas pracy na baterii. Dzięki dużemu ekranowi o przekątnej 15,6"" te notebooki zapewniają wyjątkową wydajność i niezbędne funkcje biznesowe, a także wygodną klawiaturę numeryczną. Osiągnij wysoki poziom produktywności i wydajności oraz usprawnij wielozadaniowość dzięki wydajnemu procesorowi Intel Core 12 generacji1, karcie graficznej Intel1 UHD i pojemności pamięci DDR4 do 24 GB. Monitor IPS o przekątnej 15,6""1 FHD z cienką ramką i wysokim współczynnikiem ekranu do obudowy, dzięki czemu nie przegapisz żadnego szczegółu lub gradientu kolorów. Ale to się nie kończy: technologia ComfyView redukuje odbicia światła otoczenia, zapewniając komfort oglądania w różnych warunkach. Stylowa obudowa notebooka Extensa 15 jest cieńsza i lżejsza niż kiedykolwiek. Dzięki grubości poniżej 20 mm i wadze poniżej 1,9 kg1, ten notebook będzie Ci towarzyszył wszędzie, a czas pracy baterii wynosi do 9 godzin2, co pozwala na korzystanie przez cały dzień.
Informacje prawne
Produkt nie nadaje się dla dzieci poniżej 11 roku życia. Do użytku pod nadzorem osób dorosłych","",Liczba ocen: 27,Dostępne sztuki: 7 – zamów teraz.,RGDIGITAL,"Nasz notebook Acer to SERIA SLIM z procesorem Intel i5 12 Th 10 rdzeniowym częstotliwością podstawową 2,4 GHz do 4,2 GHz w trybie seryjnym. Ekran PC ma 15,6"" FHD, laptop hp ma 20 GB pamięci RAM ddr4, ssd m2 1000 GB + Windows 11 Pro.|Procesor I5 Quad Core 20 GB RAM 1000 GB SSD NVME 1000 GB (pamięć SSD) 15,6"" wyświetlacz IPS Full HD, 3 porty USB HDMI , 1 gigabit LAN, Wi-Fi 6 AX201, TPM 2.0, kolorowa kamera internetowa HD z 2 mikrofonami. i system prywatności, bt, zestaw słuchawkowy / micD 620 rozdzielczość ekranu Full HD 1920 x 1080|Włoska klawiatura Qwerty - 1,5 do 4 godzin pracy baterii - Wbudowana karta Svga Intel UHD-HP TrueVision HD - karta Wi-Fi (802.11abgn) - Bt|LICENCJA WINDOWS 11 PROFESSIONAL 64-bitowa oryginalna z serialową ETYKIETĄ (bez DVD) już zainstalowana - Inicjalizowane za pomocą bezpłatnych programów do codziennego użytku OPEN SURCE (Office itp.). - Antywirus - aplikacja pomocy online (jeśli nie chcesz, możesz usunąć) - RGDIGITAL z 2 lat 2|Ważne informacje: Nowy produkt z oficjalną Acer – otwarty i zamknięty przez nas w celu instalacji aktualizacji (Ram) i programów (Win11)","{""Marka"":""acer"",""Producent"":""Acer"",""Seria"":""Extensa"",""Wymiary produktu"":""25 x 36 x 2 cm; 2 kg"",""Baterie:"":""1 Litowo-jonowa"",""Numer modelu"":""EX15-54"",""Kolor"":""czarne"",""Kształt"":""Laptop"",""Rozmiar wyświetlacza stojącego"":""59 Centymetry"",""Technologia wyświetlacza notebooka"":""Full HD LED"",""Rozdzielczość wyświetlania"":""1920 x 1080 pixels"",""Rozdzielczość"":""1920x1080"",""Marka procesora"":""Intel"",""Typ procesora"":""Core i5"",""Szybkość procesora"":""2,4 GHz"",""Gniazdo procesora"":""intel"",""Liczba procesorów"":""10"",""RAM"":""20 GB"",""Technologia pamięci"":""DDR4"",""Rodzaj pamieci komputera"":""DDR4 SDRAM"",""Maksymalna ilość obsługiwanej pamięci"":""24 GB"",""Pojemność dysku twardego"":""1000 GB"",""Opis dysku twardego"":""SSD"",""Interfejs dysku twardego"":""Stan sały"",""Szczegóły audio"":""Głośniki"",""Koprocesor graficzny"":""Intel Iris Xe"",""GPU"":""NVIDIA"",""Opis karty graficznej"":""Iris Xe UHD"",""Typ pamięci RAM karty graficznej"":""GDDR4"",""Rozmiar pamięci RAM karty graficznej"":""24 GB"",""Technologia komunikacji bezprzewodowej"":""Bluetooth"",""Typ bezprzewodowy"":""802.11bgn, 802.11ac"",""Liczba portów USB 3.0"":""3"",""Liczba portów HDMI"":""1"",""Liczba portów Ethernet"":""1"",""Typ napędu optycznego"":""Nie jest to"",""Rodzaj źródła zasilania"":""ac & battery"",""Platforma sprzętowa"":""Windows"",""System operacyjny"":""Windows 11 Pro"",""Średni czas pracy baterii"":""4 Godziny"",""Czy baterie są dołączone"":""Nie"",""Pojemność akumulatora litowego"":""36 Watogodziny"",""Liczba baterii litowo-jonowych"":""2"",""ASIN"":""B08668ZRY5"",""Gwarantowane aktualizacje oprogramowania do"":""nieznany(-na)""}"
"HP Laptop 15-fd0137nw | 15.6"" Full HD | Intel Core i3-1315U | 8GB RAM | 256GB SSD | Windows 11 Home | QWERTY Keyboard (Polski)",2299,https://www.amazon.pl/HP-15-fd0137nw-i3-1315U-Windows-Keyboard/dp/B0CLSCXCK4,B0CLSCXCK4,"Laptop HP 15,6 pozwala zrobić więcej, dzięki niezawodnej mocy procesora Intel, dużej pamięci masowej i wydajnej karcie graficznej w smukłym, przemyślnie zaprojektowanym urządzeniu. Ten komputer, stworzony z myślą o pracy w dowolnym miejscu oraz wykonany z tworzyw sztucznych odzyskanych przed trafieniem do oceanu i pochodzących z recyklingu pokonsumenckiego, pozwala w prosty sposób okazać trochę miłości dla naszej planety.","",Liczba ocen: 1,Dostępny,,Eliminacja migotania obrazu|Pełnowymiarowa klawiatura ze zintegrowaną klawiaturą numeryczną|Technologia HP Fast Charge,"{""Marka"":""HP"",""Producent"":""HP"",""Seria"":""15-fd0137nw"",""Wymiary opakowania"":""48,1 x 30,7 x 7,1 cm; 2,16 kg"",""Baterie:"":""1 Specyfikacja produktu (w zestawie)"",""Numer modelu"":""15-fd0137nw"",""Kolor"":""Srebrny"",""Rozmiar wyświetlacza stojącego"":""15,6 Cale"",""Rozdzielczość wyświetlania"":""1920 x 1080 pixels"",""Rozdzielczość"":""1920x1080"",""Marka procesora"":""Intel"",""Typ procesora"":""Core i3"",""Szybkość procesora"":""4.5"",""Liczba procesorów"":""1"",""Technologia pamięci"":""DDR4"",""Rodzaj pamieci komputera"":""SODIMM"",""Maksymalna ilość obsługiwanej pamięci"":""8 GB"",""Pojemność dysku twardego"":""256 GB"",""Opis dysku twardego"":""SSD"",""GPU"":""Intel"",""Opis karty graficznej"":""Zintegrowana"",""Typ pamięci RAM karty graficznej"":""DDR SDRAM"",""Interfejs karty graficznej"":""Zintegrowane"",""Liczba portów USB 3.0"":""3"",""Napięcie"":""100 Wolty"",""System operacyjny"":""Windows 11 Home"",""Czy baterie są dołączone"":""Tak"",""Pojemność akumulatora litowego"":""41 Watogodziny"",""Liczba baterii litowo-jonowych"":""3"",""ASIN"":""B0CLSCXCK4"",""Gwarantowane aktualizacje oprogramowania do"":""nieznany(-na)""}"
"HUAWEI MateBook 14 (2024) - Ultra 5, 16GB 512GB, Win11, Grau 14,2 Zoll Notebook mit 2.5K FullView Display",3720,https://www.amazon.pl/HUAWEI-MateBook-14-Notebook-FullView/dp/B0CYQ4Q821,B0CYQ4Q821,"HUAWEI MateBook 14 (2024) - Ultra 5, 16GB 512GB, Win11, Grau 14,2 Zoll Notebook mit 2.5K FullView Display","",Liczba ocen: 28,Dostępny,,53014APH,"{""Marka"":""HUAWEI"",""Producent"":""Huawei"",""Seria"":""HUAWEI MateBook 14 (2024) - Ultra 5, 16GB 512GB, Win11, Grau 14,2 Zoll Notebook mit 2.5K FullView Display"",""Wymiary produktu"":""31,26 x 22,68 x 1,45 cm; 1,31 kg"",""Baterie:"":""1 Litowo-polimerowa (w zestawie)"",""Numer modelu"":""FlemingH-W5651T"",""Wycofane przez producenta"":""Nie"",""Kolor"":""Intel Core Ultra 5"",""Kształt"":""Netbook"",""Rozmiar wyświetlacza stojącego"":""14.2"",""Rozdzielczość wyświetlania"":""2880 x 1920 pikseli"",""Rozdzielczość"":""2880x1920 Piksele"",""Marka procesora"":""Intel"",""Typ procesora"":""5X86"",""Szybkość procesora"":""3.4"",""Gniazdo procesora"":""BGA 413"",""Liczba procesorów"":""1"",""RAM"":""16 GB"",""Technologia pamięci"":""DDR3"",""Rodzaj pamieci komputera"":""SODIMM"",""Maksymalna ilość obsługiwanej pamięci"":""8 GB"",""Pojemność dysku twardego"":""80"",""Opis dysku twardego"":""HDD"",""Interfejs dysku twardego"":""ATA-4"",""Prędkość obrotowa dysku twardego"":""7200"",""Koprocesor graficzny"":""Intel HD Graphics 620 ou Intel Iris Xe Graphics"",""GPU"":""Intel"",""Opis karty graficznej"":""Dedykowana"",""Typ pamięci RAM karty graficznej"":""72-Pin EDO SIMM Memory"",""Rozmiar pamięci RAM karty graficznej"":""8"",""Interfejs karty graficznej"":""AGP"",""Technologia komunikacji bezprzewodowej"":""Bluetooth"",""Typ bezprzewodowy"":""802.11bgn"",""Liczba portów USB 2.0"":""1"",""Liczba portów USB 3.0"":""1"",""Typ napędu optycznego"":""BD-R"",""System operacyjny"":""Windows 11"",""Czy baterie są dołączone"":""Tak"",""Pojemność akumulatora litowego"":""65 Watogodziny"",""Liczba baterii litowo-jonowych"":""1"",""ASIN"":""B0CYQ4Q821"",""Gwarantowane aktualizacje oprogramowania do"":""nieznany(-na)""}"
"HP 250 G9 MODEL 2023, PC przenośny notebook gray, Intel Core i7 12Th 10 Core, Ram 16Gb, SSHD 1256Gb, wyświetlacz 15.6"" Full HD, Win 11 Pro, Libre Office, gotowy do użycia",3421,https://www.amazon.pl/HP-przeno%C5%9Bny-notebook-i7-wy%C5%9Bwietlacz/dp/B07YYLC6Y8,B07YYLC6Y8,"Nasz notebook HP to seria SLIM z procesorem Intel i7 12Th częstotliwości bazowej 2,8 GHz do 4,7 Ghz w trybie wybuchu. Ekran PC ma 15,6"" FHD, laptop hp ma 16 GB RAM ddr4, ssd m2 256Gb + hdd 1000gb i windows 11 pro. HP notebook posiada oryginalną licencję WINDOWS 11 PRO 64-bitową (bez DVD). W hołdzie dla naszych klientów instalujemy pakiet LIBRE Office 2021, Antivirus, Chrome, VLC, aby laptop był gotowy do użycia bez konieczności zabierania go do technika. Oferujemy bezpłatnie wszelkiego rodzaju pomoc online, aby doświadczenie użytkowania było tak proste, jak to tylko możliwe. Laptop ma oficjalną 2-letnią gwarancję HP, będąc partnerami. Specyfikacje techniczne: 12 Gen Intel Core i7-1255U z 10 rdzeniami, częstotliwość podstawowa od 2,8 GHz do 4,7 GHz, 15,6"" 1920 x 1080 (Full HD) IPS - Włoska klawiatura Qwerty - Czas pracy baterii 1,5 4 godziny - Zintegrowana Svga intel UHD-HP TrueVision HD - karta wifi (802.11abgn) - Bt 5.0, Interfejsy: Gniazdo słuchawkowe/mikrofonu | USB-C 3.2 Gen 1 | HDMI | LAN | 2 x USB 3.2 Gen 1 - audio 2 głośniki stereo mikrofon macierz 1 x zasilacz sieciowy - Czytnik kart","",Liczba ocen: 31,Dostępne sztuki: 7 – zamów teraz.,RGDIGITAL,"HP LED 15,6"" HD - 250 G9 CPU Intel i7-1255U 12th gen - karta graficzna Intel Iris Plus(minimalna częstotliwość przy 2,3 GHz, 10 rdzeni przy 4,7 Ghz)|HARD DISK SSD M2+ SSD - 1256GB OGÓŁEM (256 M2 + SSD 1000 ) - RAM 16GB DDR4 3200 mhz- Wyświetlacz 15,6"" Full HD Ips ris. 1920 x 1080 mpx|ekran PC 15,6"" 1920 x 1080 (Full HD) IPS antyrefleksyjna - Włoska klawiatura Qwerty - Żywotność baterii od 1,5 do 4 godzin - Wbudowana funkcja Svga intel UHD-HP TrueVision HD|karta wifi (802.11abgn) - Bt 5.0, Interfejsy: Połączone gniazdo słuchawkowe/mikrofonu | USB-C 3.2 Gen 1 | HDMI | LAN | 2 x USB 3.2 Gen 1 - audio 2 głośniki stereo mikrofon macierz -1x zasilacz sieciowy - Czytnik kart|LICENCJA WINDOWS 11 PROFESSIONAL 64 ORYGINALNY BIT Z ETYKIETA (bez DVD) - RGDIGITAL od 2 lat gwarancji online N.B. Nowy produkt z oficjalną gwarancją, otwarty i zamknięty przez nas do instalacji aktualizacji i programów","{""Marka"":""HP"",""Producent"":""HP"",""Seria"":""HP 250 G9 I7"",""Wymiary produktu"":""24,6 x 37,6 x 2,4 cm; 3 kg"",""Numer modelu"":""G10 i7"",""Kolor"":""szary"",""Kształt"":""Laptop"",""Rozmiar wyświetlacza stojącego"":""15,6 Cale"",""Rozdzielczość wyświetlania"":""1920 x 1080 pixels"",""Rozdzielczość"":""1920x1080"",""Marka procesora"":""Intel"",""Typ procesora"":""Core i7"",""Liczba procesorów"":""10"",""RAM"":""12 GB"",""Technologia pamięci"":""DDR4"",""Rodzaj pamieci komputera"":""DDR4 SDRAM"",""Maksymalna ilość obsługiwanej pamięci"":""32 GB"",""Prędkość zegara pamięci"":""3200 MHz"",""Pojemność dysku twardego"":""1256 GB"",""Opis dysku twardego"":""SSD"",""Interfejs dysku twardego"":""PCIE x 2"",""Szczegóły audio"":""Słuchawki"",""GPU"":""Intel"",""Opis karty graficznej"":""Zintegrowana"",""Typ pamięci RAM karty graficznej"":""Współdzielona"",""Rozmiar pamięci RAM karty graficznej"":""1.00"",""Interfejs karty graficznej"":""Zintegrowane"",""Technologia komunikacji bezprzewodowej"":""Wi-fi"",""Typ bezprzewodowy"":""Bluetooth, 802.11a"",""Liczba portów USB 3.0"":""3"",""Liczba portów HDMI"":""1"",""System operacyjny"":""Windows 11 Pro"",""Czy baterie są dołączone"":""Nie"",""Pojemność akumulatora litowego"":""5 Watogodziny"",""Waga akumulatora litowego"":""1 Gramy"",""Język"":""Włoski"",""ASIN"":""B07YYLC6Y8"",""Gwarantowane aktualizacje oprogramowania do"":""nieznany(-na)""}"
"Lenovo IdeaPad Slim 5 laptop | wyświetlacz Full HD 14"" | AMD Ryzen 5 5625U | 8 GB RAM | 256 GB SSD | karta graficzna AMD Radeon | Win11 Home | QWERTZ | szary | 3 miesiące Premium Care",2154,https://www.amazon.pl/Lenovo-IdeaPad-wy%C5%9Bwietlacz-graficzna-miesi%C4%85ce/dp/B0B1D6JK1J,B0B1D6JK1J,"Lenovo IdeaPad Slim 5 Laptop | wyświetlacz Full HD 14"" | AMD Ryzen R5 5625U | 8 GB RAM | 256 GB SSD | AMD Radeon RX Vega 7 | Win11 Home | QWERTZ | szary | 3 miesiące Premium Care","",Liczba ocen: 34,Dostępne sztuki: 10 – zamów teraz.,,"Niezawodna wydajność na co dzień: wyposażony w wydajny procesor i wystarczającą ilość pamięci RAM, aby bez problemu poradzić sobie z codziennymi zadaniami, takimi jak surfowanie po Internecie, e-maile, przetwarzanie tekstu i strumieniowe przesyłanie multimediów.|Przenośność: lekka i smukła konstrukcja zapewnia wygodne przenoszenie w podróży, dzięki czemu możesz łatwo zabrać laptopa ze sobą w torbie, aby zapewnić produktywność w dowolnym miejscu i czasie.|Wyświetlacz o wysokiej rozdzielczości: Ciesz się wyraźnymi obrazami i wyraźnym tekstem na wyświetlaczu Full HD o wysokiej rozdzielczości, który sprawia, że praca, przeglądanie i przesyłanie strumieniowe jest przyjemne.|Długi czas pracy baterii: energooszczędny laptop z imponującym czasem pracy baterii, który pozwala dłużej pracować bez gniazdka lub cieszyć się treściami.|Gwarancja producenta: 24 miesiące + 3 miesiące Premium Care. Warunki gwarancji można znaleźć w zakładce ""Więcej informacji technicznych"". Twoje ustawowe prawa gwarancyjne pozostają nienaruszone|Zakres dostawy: LenovoIdeaPad 5 14ABA7, Storm Grey, zasilacz, dokumentacja","{""Marka"":""Lenovo"",""Producent"":""Lenovo"",""Seria"":""Idea Pad 5"",""Wymiary produktu"":""21,18 x 32,17 x 1,69 cm; 1,39 kg"",""Baterie:"":""1 Litowo-jonowa (w zestawie)"",""Numer modelu"":""82SE007PGE"",""Kolor"":""szary"",""Kształt"":""Laptop"",""Rozmiar wyświetlacza stojącego"":""14 Cale"",""Rozdzielczość wyświetlania"":""1920 x 1080 pixels"",""Marka procesora"":""AMD"",""Liczba procesorów"":""1"",""RAM"":""8 GB"",""Rodzaj pamieci komputera"":""DDR4 SDRAM"",""Maksymalna ilość obsługiwanej pamięci"":""8 GB"",""Pojemność dysku twardego"":""256 GB"",""Szczegóły audio"":""głośniki stereo"",""GPU"":""AMD"",""Opis karty graficznej"":""Zintegrowana"",""Typ pamięci RAM karty graficznej"":""DDR4 SDRAM"",""Interfejs karty graficznej"":""Zintegrowane"",""Technologia komunikacji bezprzewodowej"":""Wi-fi"",""Liczba portów USB 3.0"":""4"",""Napięcie"":""5 Wolty"",""Typ napędu optycznego"":""Kein"",""System operacyjny"":""Windows 11 Home"",""Czy baterie są dołączone"":""Tak"",""Pojemność akumulatora litowego"":""56,5 Watogodziny"",""Liczba baterii litowo-jonowych"":""3"",""ASIN"":""B0B1D6JK1J"",""Gwarantowane aktualizacje oprogramowania do"":""nieznany(-na)""}"
